name,year,url,journal,abstract
"Co-existent diabetes mellitus and diabetes insipidus, a familial disease",1975,https://pubmed.ncbi.nlm.nih.gov/1206090/,J Clin Endocrinol Metab,"Three male siblings with diabetes mellitus are described, two of whom also had coexistent diabetes insipidus. The co-existence of diabetes mellitus and insipidus appears to represent a single genetic abnormality and may or may not be accompanied by primary optic atrophy. Chlorpropamide was effective in controlling the symptoms of diabetes mellitus and diabetes insipidus."
Endocrine aspects of sarcoidosis,1968,https://pubmed.ncbi.nlm.nih.gov/4866046/,N Engl J Med,No abstract available
Hyperosmolar coma and lithium-induced diabetes insipidus,1995,https://pubmed.ncbi.nlm.nih.gov/7475843/,Lancet,No abstract available
Endocrine and metabolic aspects of the Wolfram syndrome,2011,https://pubmed.ncbi.nlm.nih.gov/21725703/,Endocrine,"Wolfram syndrome (WS), also known as DIDMOAD (Diabetes Insipidus, Diabetes Mellitus, Optic Atrophy and Deafness), is a neurodegenerative disease with autosomal recessive inheritance with incomplete penetrance. DIDMOAD is a very rare disease with an estimated prevalence of 1 in 770,000 and it is believed to occur in 1 of 150 patients with juvenile-onset insulin-dependent diabetes mellitus. Additionally, WS may also present with different endocrine and metabolic abnormalities such as anterior and posterior pituitary gland dysfunction. This mini-review summarizes the variable presentation of WS and the need of screening for other metabolic and hormonal abnormalities, coexisting in this rare syndrome."
Studies on anti-rabphilin-3A antibodies in 15 consecutive patients presenting with central diabetes insipidus at a single referral center,2022,https://pubmed.ncbi.nlm.nih.gov/35292721/,Sci Rep,"Central diabetes insipidus (CDI) is a rare condition caused by various underlying diseases including inflammatory and autoimmune diseases, and neoplasms. Obtaining an accurate definitive diagnosis of the underlying cause of CDI is difficult. Recently, anti-rabphilin-3A antibodies were demonstrated to be a highly sensitive and specific marker of lymphocytic infundibuloneurohypophysitis (LINH). Here, we report a detailed case series, and evaluated the significance of anti-rabphilin-3A antibodies in differentiating the etiologies of CDI. A prospective analysis was conducted in 15 consecutive patients with CDI from 2013 to 2020 at a single referral center. Anti-rabphilin-3A antibodies were measured and the relationship between antibody positivity and the clinical/histopathological diagnoses was evaluated. Among 15 CDI patients, the positive anti-rabphilin-3A antibodies were found in 4 of 5 LINH cases, 3 of 4 lymphocytic panhypophysitis (LPH) cases, one of 2 sarcoidosis cases, and one intracranial germinoma case, respectively. Two Rathke cleft cyst cases and one craniopharyngioma case were negative. This is the first report of anti-rabphilin-3A antibodies positivity in CDI patients with biopsy-proven LPH. Measurement of anti-rabphilin-3A antibodies may be valuable for differentiating CDI etiologies."
A case of central diabetes insipidus due to neurophysin II gene abnormality diagnosed based on a family history of nocturnal enuresis,2022,https://pubmed.ncbi.nlm.nih.gov/34544934/,Endocr J,"The etiology of central diabetes insipidus (DI) is classified into (1) idiopathic, (2) familial, and (3) secondary. Of these, familial central diabetes insipidus shows an autosomal dominant inheritance. We herein report a case in which this disease was diagnosed based on a family history of nocturnal enuresis. A 40-year-old man had had symptoms of polydipsia, polyuria and nocturia since childhood and found that his daughter had the same symptoms. Despite reaching nine years old, his daughter's nocturnal enuresis still had not improved, resulting in her consulting a pediatrician. She was suspected of having familial neurohypophyseal diabetes insipidus (FNDI) based on her family history and was referred along with her father for a detailed examination and treatment. A hypertonic saline load test (HSLT) to evaluate the arginine vasopressin (AVP) reaction was performed in both the proband and his daughter. The results showed no increase in AVP levels in response to high plasma osmolality. The water deprivation test (WDT) revealed he was suffering from partial DI. Based on the above findings and considering the possibility of familial central diabetes insipidus, we performed a gene mutation analysis of AVP-neurophysin II (NPII). Both the father and daughter had an exon 2 abnormality in this gene (c232_234delGAG; pGlu78del), and this gene mutation is known to cause NPII protein abnormality, abolishing the function of AVP as a carrier protein. This case was considered to have provided an opportunity to understand the role of an NPII gene abnormality in familial central diabetes insipidus."
Idiopathic diabetes insipidus in a Welsh pony,1983,https://pubmed.ncbi.nlm.nih.gov/6884322/,Equine Vet J,No abstract available
"Nephrogenic diabetes insipidus, cystinosis, and vitamin D",1988,https://pubmed.ncbi.nlm.nih.gov/3389874/,Arch Dis Child,"We describe a patient with early diagnosed cystinosis who presented with nephrogenic diabetes insipidus in addition to proximal tubular dysfunction. Another feature in this patient was abnormally low serum concentration of 24,25 dihydroxy vitamin D3 (24,25(OH)2D3) with normal 25 hydroxy vitamin D3 (25(OH)D3) and relatively low 1,25 dihydroxy vitamin D3 (1,25(OH)2D3)."
[Human tasteless diabetes],1947,https://pubmed.ncbi.nlm.nih.gov/20246707/,Praxis,No abstract available
Water metabolism in diabetes mellitus,1981,https://pubmed.ncbi.nlm.nih.gov/7457488/,Am J Med,"Transcellular shifts of water and changes in the physiology of water excretion are common in diabetes mellitus and its treatment. Recent evidence indicates that hyperglycemia in diabetic patients, but not in normal subjects, is characterized by elevations of circulating levels of arginine vasopressin (AVP; antidiuretic hormone, ADH). The role and importance of these observations remain to be defined since elevations of plasma AVP levels do not decrease water excretion in diabetic patients. Certain oral sulfonylureas, notably chlorpropamide and tolbutamide, are known to decrease renal free water clearance (CH2O), whereas insulin increases CH2O; the insulin and tolbutamide effects may be clinically trivial, whereas that of chlorpropamide is important. The hyponatremic effect of chlorpropamide may be exaggerated in diabetic patients by concomitant diuretic therapy. Euglycemia during chlorpropamide therapy appears to allow full expression of the action of chlorpropamide on CH2O; hyperglycemia with attendant osmotic diuresis protects chlorpropamide-treated patients against hyponatremia. Inhibition of prostaglandin synthesis with nonsteroidal anti-inflammatory agents enhances expression of the ADH effect on the kidney, but it does not appear to potentiate chlorpropamide hyponatremia. Two other oral sulfonylurea agents, tolazamide and glyburide, increase CH2O. Diazoxide is an antihypertensive thiazide which is antidiuretic as well as hyperglycemic. Thus, abnormalities of water metabolism are common in diabetes mellitus. Whether certain of these abnormalities are clinically important depends upon the presence of the osmotic diuresis of hyperglycemia and the pharmacology of diabetic management."
Glucose intolerance in diabetes insipidus,1974,https://pubmed.ncbi.nlm.nih.gov/4821330/,Am J Med Sci,No abstract available
A 7-year-old boy with central diabetes insipidus presenting with thickened pituitary stalk and anti-rabphilin-3A antibody positivity,2022,https://pubmed.ncbi.nlm.nih.gov/35119230/,J Pediatr Endocrinol Metab,"Objectives: A highly invasive pathological diagnosis is necessary to differentiate central diabetes insipidus (CDI) with a thickened pituitary stalk. Lymphocytic infundibulo-hypophysitis (LIH) due to autoimmune involvement of the pituitary stalk is a differentiating disease, and anti-rabphilin-3A antibody (Rab3A-Ab) positivity was recently reported.
Case presentation: A 7-year-old boy was diagnosed with CDI after having polyuria for two months. He showed growth hormone deficiency with reduced growth rate. Brain magnetic resonance imaging (MRI) revealed a thickened pituitary stalk. The placental alkaline phosphatase level of the cerebrospinal fluid, tumor marker for germ cell tumors, was below the level of sensitivity. No skin or bone findings suggestive of Langerhans cell histiocytosis were detected. Eight months after CDI onset, Rab3A-Ab was positive, and MRI showed shrinking of the thickened pituitary stalk, leading to the diagnosis with LIH.
Conclusions: Rab3A-Ab is a useful adjunctive diagnostic tool for childhood-onset LIH."
[Neurophysin],2005,https://pubmed.ncbi.nlm.nih.gov/16149500/,Nihon Rinsho,No abstract available
Treatment of diabetes insipidus with hydrochlorothiazide,1959,https://pubmed.ncbi.nlm.nih.gov/13655610/,Lancet,No abstract available
On the term diabetes in the works of Aretaeus and Galen,1969,https://pubmed.ncbi.nlm.nih.gov/4890048/,Med Hist,No abstract available
"Association of diabetes insipidus, diabetes mellitus, optic atrophy, and deafness. The Wolfram or DIDMOAD syndrome",1985,https://pubmed.ncbi.nlm.nih.gov/4051539/,Arch Dis Child,"Seven patients with a rare syndrome of diabetes insipidus (DI), diabetes mellitus (DM), optic atrophy (OA), neurosensory deafness (D), atony of the urinary tract, and other abnormalities (Wolfram or DIDMOAD syndrome) are reported. Of the seven patients, three siblings were followed up for 10-17 years. All seven patients had diabetes mellitus and optic atrophy; six had diabetes insipidus; and in the four patients investigated there was dilatation of the urinary tract. The severity of diabetes varied, and all required insulin for control of the hyperglycaemia. In one patient the course of the disease simulated maturity onset diabetes of the young; another presented with ketoacidosis; but none had haplotypes usually associated with insulin dependent diabetes mellitus. The diabetes insipidus responded to chlorpropamide, suggesting partial antidiuretic hormone deficiency. Onset of optic atrophy and loss of vision occurred relatively late and progressed slowly, although in one patient there was a rapid deterioration in visual acuity. Deafness was mild, of late onset, and of sensorineural origin. A degenerative process affecting the central and peripheral nervous system can explain all the manifestations of the syndrome except diabetes mellitus. The pathogenesis of the diabetes mellitus remains obscure."
Selected feline endocrinopathies,1984,https://pubmed.ncbi.nlm.nih.gov/6393555/,Vet Clin North Am Small Anim Pract,No abstract available
Treatment of diabetes insipidus complicated by diabetes mellitus with chlorpropamide and clofibrate,1980,https://pubmed.ncbi.nlm.nih.gov/7453091/,Klin Wochenschr,"A patient with severe idiopathic diabetes insipidus, complicated by diabetes mellitus, was first treated with a combination o clofibrate and chlorpropamide. Urine volume dropped from 18 litres/day (CH2O = 10.5 ml/min) to 3.1-5.1 litres/day (CH2O = -0.1 -+1.1 ml/min) under treatment. Ten months after the beginning of therapy treatment was maintained with chlorpropamide alone; no significant rise in urine volume was observed. After 18 months when therapy was stopped for 5 days urine volume rose to 11.7 litres/day maximum (CH2O = 6.6 ml/min). No obvious side effects occurred under treatment during a follow up for over 18 months. Serum levels for arginine vasopressin before and under treatment were below 1.0 pg/ml. Determination of free water clearance (CH2O) proved to be a highly sensitive and simple method for follow up controls. It is discussed whether the coincidental manifestation of diabetes insipidus and diabetes mellitus may be caused by a single molecular lesion. This hypothesis is supported by data which imply that in both disease chlorpropamide acts via a common molecular mechanism, the blocking of endogenous prostaglandin E2 biosynthesis. Finally a treatment with oral ""non-hormonal"" drugs like clofibrate and chlorpropamide should be taken into consideration in some cases of diabetes insipidus as is demonstrated by this case report."
[Nephrogenic diabetes insipidus],1980,https://pubmed.ncbi.nlm.nih.gov/7409651/,Harefuah,No abstract available
[Current concepts concerning the genetic transmission of diabetes mellitus. II. Mechanism of action of the gene],1973,https://pubmed.ncbi.nlm.nih.gov/4276914/,Med Interna (Bucur),No abstract available
[Diabetes insipidus during the treatment of schizophrenia with chlorpromazine],1955,https://pubmed.ncbi.nlm.nih.gov/13278669/,J Med Bord,No abstract available
Diabetes mellitus and optic atrophy: a study of Wolfram syndrome in the Lebanese population,2004,https://pubmed.ncbi.nlm.nih.gov/15070927/,J Clin Endocrinol Metab,"Wolfram syndrome (WFS) is a rare hereditary neurodegenerative disorder also known as DIDMOAD (diabetes insipidus, diabetes mellitus, optic atrophy, and deafness). WFS seems to be a heterogeneous disease that has not yet been fully characterized in terms of clinical features and pathophysiological mechanisms because the number of patients in most series was small. In this study we describe 31 Lebanese WFS patients belonging to 17 families; this, to our knowledge, is the largest number of patients reported in one series so far. Criteria for diagnosis of WFS were the presence of insulin-dependent diabetes mellitus and optic atrophy unexplained by any other disease. Central diabetes insipidus was found in 87% of the patients, and sensorineural deafness confirmed by audiograms was present in 64.5%. Other less frequent features included neurological and psychiatric abnormalities, urodynamic abnormalities, limited joint motility, cardiovascular and gastrointestinal autonomic neuropathy, hypergonadotropic hypogonadism in males, and diabetic microvascular disease. New features, not reported in previous descriptions, such as heart malformations and anterior pituitary dysfunction, were recognized in some of the patients and participated in the morbidity and mortality of the disease. Genetic analysis revealed WFS1 gene mutations in three families (23.5%), whereas no abnormalities were detected in mitochondrial DNA. In conclusion, WFS is a devastating disease for the patients and their families. More information about WFS will lead to a better understanding of this disease and hopefully to improvement in means of its prevention and treatment."
Diabetes insipidus and diabetes mellitus in a six-year-old girl,1968,https://pubmed.ncbi.nlm.nih.gov/5668377/,J Pediatr,No abstract available
"Diabetes inspidius, diabetes mellitus, and insulin resistance with histiocytosis",1954,https://pubmed.ncbi.nlm.nih.gov/13191976/,J Am Med Assoc,No abstract available
[The role of the 3d trimester of gestation in the detection of latent diabetes],1968,https://pubmed.ncbi.nlm.nih.gov/4884597/,Ginekol Pol,No abstract available
Current developments in Wolfram syndrome,2009,https://pubmed.ncbi.nlm.nih.gov/19344068/,J Pediatr Endocrinol Metab,"Wolfram syndrome (WS), an infrequent cause of diabetes mellitus, derives its name from the physician who first reported the combination of juvenile-onset diabetes mellitus and optic atrophy. Also referred to as DIDMOAD (diabetes insipidus, diabetes mellitus, optic atrophy and deafness), it is an autosomal recessive neurodegenerative disease characterized by various clinical manifestations, such as diabetes mellitus, optic atrophy, diabetes insipidus, deafness, neurological symptoms, renal tract abnormalities, psychiatric manifestations and gonadal disorders. The condition is very rare with an estimated prevalence of one in 770,000 of the normal population, one out of 150 cases of juvenile-onset insulin-dependent diabetes mellitus, and with a carrier frequency of one in 354. This progressive neurodegenerative disease usually results in death before the age of 50 years and many patients lead a morbid life. The pathogenesis of the disorder although unknown is ascribed to mutation of a gene on chromosome 4p encoding a transmembrane protein of undetermined function called wolframin. This review summarizes the variable presentation of the disorder, its widespread complications, poor quality of life in affected individuals, and the problems in diagnosis and treatment of the syndrome."
Change in cephalocaudal tumor cavity diameter after transsphenoidal surgery is a predictor of diabetes insipidus in pituitary adenoma,2022,https://pubmed.ncbi.nlm.nih.gov/35614499/,Eur J Med Res,"Objective: To assess the factors influencing the development of diabetes insipidus after transsphenoidal surgery for pituitary adenomas.
Methods: We retrospectively analyzed the clinical data of patients with pituitary adenoma who underwent transsphenoidal surgery. The pituitary gland was assessed using a 3.0 T magnetic resonance imaging, and the predictors of postoperative diabetes insipidus were determined through univariate and multivariate analyses.
Results: A total of 212 eligible patients with pituitary adenomas were included; 82 (38.7%) cases developed postoperative diabetes insipidus while 130 cases (61.3%) did not. Diabetes insipidus was transient in 80 (37.7%) patients and permanent in 2 (0.9%) patients. The results of logistic regression analyses showed that the change in cephalocaudal tumor cavity diameter after transsphenoidal surgery was associated with the occurrence of postoperative diabetes insipidus.
Conclusions: Change in cephalocaudal tumor cavity diameter after transsphenoidal surgery may play an important role in predicting diabetes insipidus onset in patients with a pituitary adenoma."
Wolfram (DIDMOAD) syndrome,1997,https://pubmed.ncbi.nlm.nih.gov/9350817/,J Med Genet,"Wolfram syndrome (MIM 222300) is the association of juvenile onset diabetes mellitus and optic atrophy, also known as DIDMOAD (Diabetes Insipidus, Diabetes Mellitus, Optic Atrophy, and Deafness). Patients present with diabetes mellitus followed by optic atrophy in the first decade, cranial diabetes insipidus and sensorineural deafness in the second decade, dilated renal outflow tracts early in the third decade, and multiple neurological abnormalities early in the fourth decade. Other abnormalities include primary gonadal atrophy. Death occurs prematurely, often from respiratory failure associated with brainstem atrophy. Most patients eventually develop all complications of this progressive, neurodegenerative disorder. The pathogenesis is unknown, but the prevalence is 1 in 770000 in the UK and inheritance is autosomal recessive. A Wolfram gene has recently been mapped to chromosome 4p16.1, but there is evidence for locus heterogeneity, and it is still possible that a minority of patients may harbour a mitochondrial genome deletion. The best available diagnostic criteria are juvenile onset diabetes mellitus and optic atrophy, but there is a wide differential diagnosis which includes other causes of neurodegeneration."
[Nephrogenic diabetes insipidus],1972,https://pubmed.ncbi.nlm.nih.gov/5019694/,Pediatr Pol,No abstract available
"Recessive inheritance of diabetes: the syndrome of diabetes insipidus, diabetes mellitus, optic atrophy and deafness",1976,https://pubmed.ncbi.nlm.nih.gov/948548/,Q J Med,"A few rare syndromes have been delineated in which diabetes mellitus is inherited in association with other conditions. This paper describes five patients, including four siblings in one family, who have diabetes insipidus, diabetes mellitus, optic atrophy and deafness (the DIDMOAD syndrome). The parents of both families are normal but are first cousins. All the patients have insulin-dependent diabetes mellitus with a typical juvenile-onset. The onset of diabetes insipidus was insidious and the symptoms could easily have been ascribed to poor control of diabetes mellitus. The importance of diagnosing diabetes insipidus is that all these patients had dilatation of the urinary tract varying from mild hydroureter to severe hydronephrosis and this improved with treatment of the diabetes insipidus. It is suggested that patients with diabetes mellitus and optic atrophy should have regular screening tests for diabetes insipidus since it is likely that they represent cases of the full syndrome with incomplete clinical expression. The occurrence of this rare syndrome in four siblings of unaffected parents indicates that the syndrome is due to a recessive gene, but the pathogenesis is unknown."
"Glucagon-stimulated copeptin measurements in the differential diagnosis of diabetes insipidus: a double-blind, randomized, placebo-controlled study",2022,https://pubmed.ncbi.nlm.nih.gov/35521789/,Eur J Endocrinol,"Background: The differential diagnosis of diabetes insipidus is challenging. The most reliable approaches are copeptin measurements after hypertonic saline infusion or arginine, which is a known growth hormone secretagogue but has recently also been shown to stimulate the neurohypophysis. Similar to arginine, glucagon stimulates growth hormone release, but its effect on the neurohypophysis is poorly studied.
Design: Double-blind, randomized, placebo-controlled trial including 22 healthy participants, 10 patients with central diabetes insipidus, and 10 patients with primary polydipsia at the University Hospital Basel, Switzerland.
Methods: Each participant underwent the glucagon test (s.c. injection of 1 mg glucagon) and placebo test. The primary objective was to determine whether glucagon stimulates copeptin and to explore whether the copeptin response differentiates between diabetes insipidus and primary polydipsia. Copeptin levels were measured at baseline, 30, 60, 90, 120, 150, and 180 min after injection.
Results: In healthy participants, glucagon stimulated copeptin with a median increase of 7.56 (2.38; 28.03) pmol/L, while placebo had no effect (0.10 pmol/L (-0.70; 0.68); P < 0.001). In patients with diabetes insipidus, copeptin showed no relevant increase upon glucagon, with an increase of 0.55 (0.21; 1.65) pmol/L, whereas copeptin was stimulated in patients with primary polydipsia with an increase of 15.70 (5.99; 24.39) pmol/L. Using a copeptin cut-off level of 4.6pmol/L had a sensitivity of 100% (95% CI: 100-100) and a specificity of 90% (95% CI: 70-100) to discriminate between diabetes insipidus and primary polydipsia.
Conclusion: Glucagon stimulates the neurohypophysis, and glucagon-stimulated copeptin has the potential for a safe, novel, and precise test in the differential diagnosis of diabetes insipidus."
DIABETES MELLITUS AND INSIPIDUS IN TWO SISTERS,1963,https://pubmed.ncbi.nlm.nih.gov/14066185/,Br Med J,No abstract available
Central Diabetes Insipidus after Syndrome of Inappropriate Antidiuretic Hormone Secretion with Severe Hyponatremia in a Patient with Rathke's Cleft Cyst,2022,https://pubmed.ncbi.nlm.nih.gov/34248116/,Intern Med,"A 49-year-old man developed severe hyponatremia associated with transient headache and was diagnosed with syndrome of inappropriate antidiuretic hormone secretion (SIADH). Fluid restriction and sodium supplementation corrected the hyponatremia. However, several days later, the patient exhibited hypernatremia with thirst and polyuria. A detailed examination indicated central diabetes insipidus (CDI) with an intrasellar cystic lesion indicative of Rathke's cleft cyst (RCC). A case of RCC exhibiting headache, hyponatremia, and subsequent hypernatremia has been reported. Our case shows that CDI may appear after SIADH in patients with RCC, especially in those with serum sodium levels that unexpectedly increase rapidly beyond the reference range."
[Gestational diabetes insipidus during a twin pregnancy],2013,https://pubmed.ncbi.nlm.nih.gov/23380272/,Ann Fr Anesth Reanim,"Gestational diabetes insipidus is an uncommon clinical disease whose prevalence is approximately two to three pregnancies per 100,000. It may be isolated or associated with preeclampsia. We report a case of gestational diabetes insipidus in a twin pregnancy, originally isolated during two months, and secondarily complicated by HELLP-syndrome. We recall the specific pathophysiology of polyuric-polydipsic syndrome during pregnancy and summarize its various causes. Finally, we discuss the indications, in case of isolated gestational diabetes insipidus, of treatment by dDAVP."
[Diabetes insipidus induced by pregnancy. A case report],2013,https://pubmed.ncbi.nlm.nih.gov/22520166/,Endocrinol Nutr,No abstract available
